{
  "$schema": "https://altinity.com/schemas/altinity-sql-browser/portable-bundle-v1.schema.json",
  "format": "altinity-sql-browser/portable-bundle",
  "version": 1,
  "exportedAt": "2026-07-13T05:01:01.000Z",
  "metadata": {
    "name": "Server log panel example",
    "description": "Parameterized system.text_log dashboard example."
  },
  "queries": [
    {
      "id": "log-1",
      "sql": "SELECT event_time, level, logger_name, message\nFROM system.text_log\nWHERE event_time > {from:DateTime}\n/*[ AND event_time <= {to:DateTime} ]*/\n/*[ AND level = {level:Enum8('Fatal' = 1, 'Critical' = 2, 'Error' = 3, 'Warning' = 4, 'Notice' = 5, 'Information' = 6, 'Debug' = 7, 'Trace' = 8, 'Test' = 9)} ]*/\n/*[ AND positionCaseInsensitive(logger_name, {logger:String}) > 0 ]*/\n/*[ AND positionCaseInsensitive(message, {message:String}) > 0 ]*/\nORDER BY event_time DESC\nLIMIT 500",
      "specVersion": 1,
      "spec": {
        "name": "Server logs in a time range",
        "favorite": true,
        "description": "{from:DateTime} is required (drives the Dashboard's global From filter, and accepts a relative expression like -1h/now-7d). to/level/logger/message are wrapped in /*[ ... ]*/ optional blocks, so they're non-required: blank ones drop out of the query entirely, filling one in adds its predicate. level renders as a dropdown (declared Enum8 member names); logger/message use positionCaseInsensitive(...) > 0 for a plain case-insensitive substring search — no ILIKE wildcard footgun if the search term itself contains a literal % or _.",
        "view": "panel",
        "panel": {
          "cfg": {
            "type": "logs",
            "time": "event_time",
            "msg": "message",
            "level": "level"
          }
        },
        "dashboard": {
          "role": "panel",
          "sizeHints": {
            "preferred": "wide",
            "minimum": "medium",
            "aspectRatio": 1.6
          }
        }
      }
    }
  ],
  "dashboards": [
    {
      "documentVersion": 1,
      "id": "text-log-panel-example",
      "title": "Server log panel example",
      "description": "Parameterized system.text_log dashboard example.",
      "revision": 1,
      "layout": {
        "type": "flow",
        "version": 1,
        "preset": "report",
        "items": {
          "tile-log-1": {
            "span": 1,
            "height": "large"
          }
        }
      },
      "filters": [
        {
          "id": "filter-from",
          "parameter": "from"
        },
        {
          "id": "filter-to",
          "parameter": "to"
        },
        {
          "id": "filter-level",
          "parameter": "level"
        },
        {
          "id": "filter-logger",
          "parameter": "logger"
        },
        {
          "id": "filter-message",
          "parameter": "message"
        }
      ],
      "tiles": [
        {
          "id": "tile-log-1",
          "queryId": "log-1"
        }
      ]
    }
  ]
}
